
* The Third Kinslaying: the remaining Sons of Fëanor of Fëanor, desiring the Silmaril, attack the remnants of Doriath and Gondolin at the Mouths of Sirion., p. 348
* Círdan and Gil-galad send aid to the Havens. The arrive too late and the people are defeated; the refugees move to the Isle of Balar.
* Death of Amrod and Amras.
* Elrond and Elros are taken captive by Maglor, but Maglor comes to love the boys and fosters them.
* Elwing, bearing the Silmaril, casts herself into Belegaer. Ulmo bears her up in the likeness of a swan and she finds Eärendil.

Category:First Age years