{{ardayearheader|2859|2860|2861|2862|2863|2864|2865}}

* Birth of [[Isengar Took]], twelfth child and eighth son of [[Thain]] [[Gerontius Took]] and [[Adamanta Chubb]].<ref>{{App|Took}}</ref>
* Birth of [[Linda Baggins]], fourth child and second daughter of [[Mungo Baggins]] and [[Laura Grubb]].<ref>{{App|Baggins}}</ref>
* Birth of [[Rose (daughter of Holman)|Rose]], fifth child and second daughter of [[Holman the greenhanded]].<ref>{{App|Gamgee}}</ref>
{{references}}
[[Category:Third Age years|2, Third Age 2862]]